{
  "$schema": "https://json-schema.org/draft/2020-12/schema",
  "$id": "urn:hmcts:cpp:public.notificationnotify.events.notification-sent",
  "title": "public.notificationnotify.events.notification-sent",
  "description": "Golden-master result-event contract ported verbatim from cpp-context-notification-notify (see docs/pipeline/legacy-result-event-contract.md). Additive-only evolution.",
  "type": "object",
  "additionalProperties": false,
  "required": [
    "notificationId",
    "sentTime"
  ],
  "properties": {
    "notificationId": {
      "type": "string",
      "format": "uuid"
    },
    "sentTime": {
      "type": "string",
      "format": "date-time"
    },
    "completedAt": {
      "type": "string",
      "format": "date-time"
    },
    "sendToAddress": {
      "type": "string"
    },
    "replyToAddress": {
      "type": "string",
      "format": "email"
    },
    "emailSubject": {
      "type": "string"
    },
    "emailBody": {
      "type": "string"
    },
    "clientContext": {
      "type": "string"
    }
  }
}
